{
  "$schema": "https://json-schema.org/draft/2020-12/schema",
  "$id": "https://nutriapp.internal/schemas/user_followed.v1.json",
  "title": "UserFollowed",
  "type": "object",
  "required": ["event_id", "aggregate_id", "event_type", "version", "occurred_at", "payload", "metadata"],
  "properties": {
    "event_id": { "type": "string", "format": "uuid" },
    "aggregate_id": { "type": "string", "format": "uuid" },
    "event_type": { "const": "UserFollowed" },
    "version": { "const": 1 },
    "occurred_at": { "type": "string", "format": "date-time" },
    "payload": {
      "type": "object",
      "required": ["follow_id", "follower_id", "followee_id", "followed_at"],
      "properties": {
        "follow_id": { "type": "string", "format": "uuid" },
        "follower_id": { "type": "string", "format": "uuid" },
        "followee_id": { "type": "string", "format": "uuid" },
        "followed_at": { "type": "string", "format": "date-time" }
      },
      "additionalProperties": false
    },
    "metadata": {
      "type": "object",
      "required": ["correlation_id"],
      "properties": {
        "correlation_id": { "type": "string" },
        "causation_id": { "type": ["string", "null"] },
        "user_id": { "type": ["string", "null"] }
      },
      "additionalProperties": false
    }
  },
  "additionalProperties": false
}
