{
  "event_id": "88888888-8888-8888-8888-888888888881",
  "aggregate_id": "55555555-5555-5555-5555-555555555551",
  "event_type": "UserFollowed",
  "version": 1,
  "occurred_at": "2026-08-31T09:10:00+00:00",
  "payload": {
    "follow_id": "55555555-5555-5555-5555-555555555551",
    "follower_id": "66666666-6666-6666-6666-666666666662",
    "followee_id": "22222222-2222-2222-2222-222222222225",
    "followed_at": "2026-08-31T09:10:00+00:00"
  },
  "metadata": {
    "correlation_id": "44444444-4444-4444-4444-444444444447",
    "causation_id": "44444444-4444-4444-4444-444444444447",
    "user_id": "66666666-6666-6666-6666-666666666662"
  }
}
